{
  "schemaVersion": 1,
  "sessionId": "session_01HF7U18q2La6qiCg7MLzD8U",
  "url": "https://claude.ai/code/session_01HF7U18q2La6qiCg7MLzD8U",
  "lane": "experience",
  "branch": "lane/experience",
  "purpose": "Revise plan for one-state voice scope (D-coord-011/012)",
  "startedAt": "2026-10-03T14:01:59Z",
  "lastSeenAt": "2026-10-03T14:35:50Z"
}
