{
  "schemaVersion": 1,
  "sessionId": "session_01VAT2w9TTWLQAeoV81MAgwd",
  "url": "https://claude.ai/code/session_01VAT2w9TTWLQAeoV81MAgwd",
  "lane": "sensing",
  "branch": "lane/sensing",
  "purpose": "M0 setup check and lane plan",
  "startedAt": "2026-10-03T14:01:55Z",
  "lastSeenAt": "2026-10-03T14:03:17Z"
}
