{
  "schemaVersion": 1,
  "sessionId": "session_01UjPLF5iM3KV4h5gxwZqeJD",
  "url": "https://claude.ai/code/session_01UjPLF5iM3KV4h5gxwZqeJD",
  "lane": "coord",
  "branch": "claude/strategy-storage-cloudflare-txlooc",
  "purpose": "",
  "startedAt": "2026-10-03T19:33:00Z",
  "lastSeenAt": "2026-10-03T19:33:00Z"
}
