{
  "schemaVersion": 1,
  "sessionId": "session_01AUPD3DWvpWuBX5tGm9JxwU",
  "url": "https://claude.ai/code/session_01AUPD3DWvpWuBX5tGm9JxwU",
  "lane": "onboarding",
  "branch": "claude/project-thread-c4ldi5",
  "purpose": "Question harness MVP: state choice, Robbins strategy questions with 5 s language hints, saved strategy, one-click playback, visual test",
  "startedAt": "2026-10-03T15:25:58Z",
  "lastSeenAt": "2026-10-03T17:17:44Z"
}
