{
  "schemaVersion": 1,
  "sessionId": "session_01SFJDNnn8vf7PngcUX3GDf2",
  "url": "https://claude.ai/code/session_01SFJDNnn8vf7PngcUX3GDf2",
  "lane": "onboarding",
  "branch": "lane/onboarding",
  "purpose": "M0 setup check and lane plan",
  "startedAt": "2026-10-03T14:01:56Z",
  "lastSeenAt": "2026-10-03T14:04:58Z"
}
