{
  "schemaVersion": 1,
  "sessionId": "codex-01a10169-c218-77b3-9532-75e07c5cb774",
  "url": null,
  "lane": "coord",
  "branch": "codex/synthetic-calming-workflow",
  "purpose": "Add the user-requested offline synthetic calming workflow lab and Oura import research",
  "startedAt": "2026-10-03T17:42:18Z",
  "lastSeenAt": "2026-10-03T18:07:00Z"
}
