{
  "schemaVersion": 1,
  "sessionId": "session_01UjPLF5iM3KV4h5gxwZqeJD",
  "url": "https://claude.ai/code/session_01UjPLF5iM3KV4h5gxwZqeJD",
  "lane": "onboarding",
  "branch": "claude/strategy-storage-cloudflare-txlooc",
  "purpose": "Strategy storage, retry loop, rep tracking and Cloudflare deploy on top of the question harness (PR #23)",
  "startedAt": "2026-10-03T17:47:54Z",
  "lastSeenAt": "2026-10-03T19:38:34Z"
}
