{
  "schemaVersion": 1,
  "sessionId": "session_01FpUSvVKQswepdzRd8iGswL",
  "url": "https://claude.ai/code/session_01FpUSvVKQswepdzRd8iGswL",
  "lane": "onboarding",
  "branch": "claude/project-thread-r75yty",
  "purpose": "Three white-light minimal-text design prototypes for the question harness, separate branch",
  "startedAt": "2026-10-03T17:43:36Z",
  "lastSeenAt": "2026-10-03T18:30:59Z"
}
