{
  "schemaVersion": 1,
  "sessionId": "session_019NEuX43D3Zw9SpzLcMMCwp",
  "url": "https://claude.ai/code/session_019NEuX43D3Zw9SpzLcMMCwp",
  "lane": "contracts",
  "branch": "lane/contracts",
  "purpose": "Replan Profile v2 for D-coord-011/012 scope change",
  "startedAt": "2026-10-03T14:01:58Z",
  "lastSeenAt": "2026-10-03T14:36:33Z"
}
