{
  "schemaVersion": 1,
  "sessionId": "session_01QVbLwShgFGPq3zbXjnSGBK",
  "url": "https://claude.ai/code/session_01QVbLwShgFGPq3zbXjnSGBK",
  "lane": "coord",
  "branch": "claude/awesome-wright-ciik1f",
  "purpose": "Coordinator: protocol, dashboard, lanes, integration",
  "startedAt": "2026-10-03T13:53:54Z",
  "lastSeenAt": "2026-10-03T14:36:40Z"
}
